{"$schema":"https://json-schema.org/draft/2020-12/schema","title":"Export Profile v1","type":"object","additionalProperties":false,"required":["schema_version","profile_id","engine","scale","forward_axis","up_axis","materials","animation_mode","root_motion","textures","compression","budgets"],"properties":{"schema_version":{"const":1},"profile_id":{"type":"string"},"engine":{"enum":["godot","unity","unreal"]},"scale":{"type":"number","exclusiveMinimum":0},"forward_axis":{"type":"string"},"up_axis":{"type":"string"},"materials":{"enum":["embedded","external"]},"animation_mode":{"enum":["actions","scene"]},"root_motion":{"enum":["none","root_bone"]},"textures":{"enum":["embedded","copy"]},"compression":{"type":"boolean"},"budgets":{"type":"object","required":["max_objects","max_faces","max_materials","max_colors"],"additionalProperties":false,"properties":{"max_objects":{"type":"integer","minimum":1},"max_faces":{"type":"integer","minimum":1},"max_materials":{"type":"integer","minimum":1},"max_colors":{"type":"integer","minimum":1}}}}}
