{"schema_version":1,"profile_id":"unity_character","engine":"unity","scale":1.0,"forward_axis":"Z","up_axis":"Y","materials":"embedded","animation_mode":"actions","root_motion":"none","textures":"embedded","compression":false,"budgets":{"max_objects":32,"max_faces":250000,"max_materials":64,"max_colors":256}}
