{"schema_version":1,"profile_id":"unreal_character","engine":"unreal","scale":100.0,"forward_axis":"X","up_axis":"Z","materials":"embedded","animation_mode":"actions","root_motion":"none","textures":"embedded","compression":false,"budgets":{"max_objects":32,"max_faces":250000,"max_materials":64,"max_colors":256}}
